{
  "status": "approved",
  "agent": "code-reviewer",
  "reasoning": "All 33 tests pass and qa-tester found zero logic or security issues (severity none), so neither automatic-reject rule applies. Own reading of password_generator.py confirms the two load-bearing design claims actually hold in code: (1) randomness is exclusively from secrets (secrets.choice for character selection, secrets.randbelow-driven Fisher-Yates for shuffling) with random never imported; (2) length validation correctly enforces [MIN_LENGTH=8, MAX_LENGTH=1024], rejects bool before the general int check, and raises TypeError for non-int / ValueError for out-of-range as specified. Cross-checking against password_strength.py confirms the generator's character pools satisfy the checker's exact rule definitions, so the 'always rates strong' claim holds structurally. The guarantee-then-fill-then-shuffle construction matches architecture.md, and the function is pure as required.",
  "rejection_feedback": [],
  "confidence": "high",
  "requires_human_spotcheck": false
}
